link,title,variation
https://shopee.vn/Thuốc-nhuộm-tóc-màu-ĐEN-TUYỀN-ĐEN-TỰ-NHIÊN-thuốc-nhuộm-tóc-không-cần-tẩy-kem-nhuộm-tóc-tại-nhà-Buddyhairs-tặng-kèm-dụ-i.302719943.3649914081?sp_atk=f679836f-1f88-4d92-b1e6-d1e5807e98e1&xptdk=f679836f-1f88-4d92-b1e6-d1e5807e98e1,"Yêu thích+Thuốc nhuộm tóc màu ĐEN TUYỀN, ĐEN TỰ NHIÊN, thuốc nhuộm tóc không cần tẩy, kem nhuộm tóc tại nhà Buddyhairs tặng kèm dụ",ĐEN TUYỀN|||Dưỡng nhiều - 200
https://shopee.vn/Thuốc-nhuộm-tóc-màu-Đen-thuốc-nhuộm-tóc-màu-Đen-Tuyền-JunHair-tặng-kèm-oxi-trợ-dưỡng-bao-trai-mũ-trùm-bịt-tai-i.1010767544.25701963984?sp_atk=5cc525c1-7f11-49a7-aac3-06cd590c4e1a&xptdk=5cc525c1-7f11-49a7-aac3-06cd590c4e1a,"Yêu thíchThuốc nhuộm tóc màu Đen, thuốc nhuộm tóc màu Đen Tuyền, JunHair, tặng kèm oxi trợ dưỡng bao trai mũ trùm bịt tai",Dưỡng Keratin|||Không
https://shopee.vn/Thuốc-Nhuộm-Tóc-Màu-Đen-Tuyền-Thuốc-nhuộm-Tóc-chính-hãng-tặng-kèm-Oxy-Bao-Tay-Cherry_Hair.-Cherry-Hair-i.939128713.22721604596?sp_atk=60904842-d7e4-413c-ba82-926bec9e3ca7&xptdk=60904842-d7e4-413c-ba82-926bec9e3ca7,"Yêu thích+Thuốc Nhuộm Tóc Màu Đen Tuyền Thuốc nhuộm Tóc chính hãng tặng kèm Oxy + Bao Tay, Cherry_Hair. Cherry Hair",Nhuộm dưỡng collagen|||không
https://shopee.vn/Thuốc-nhuộm-tóc-màu-đen-tuyền-tặng-kèm-oxy-trợ-dưỡng-và-bao-tay-i.596004543.17919564210?sp_atk=b2384eb1-0ff8-46e2-9079-baf7570ade02&xptdk=b2384eb1-0ff8-46e2-9079-baf7570ade02,"Thuốc nhuộm tóc màu đen tuyền , tặng kèm oxy trợ dưỡng và bao tay",Nhuộm Dưỡng Nhẹ
https://shopee.vn/thuốc-nhuộm-tóc-màu-đen-tuyền-.-combo-thuốc-nhuộm-tóc-tại-nhà-i.898763646.23604696884?sp_atk=7c51a42e-3413-4ce0-baa7-828893bf8db6&xptdk=7c51a42e-3413-4ce0-baa7-828893bf8db6,Yêu thích+thuốc nhuộm tóc màu đen tuyền . combo thuốc nhuộm tóc tại nhà,nhuộm dưỡng
https://shopee.vn/Thuốc-Nhuộm-Tóc-Màu-ĐEN-TUYỀN-Không-Tẩy-Tặng-kèm-Oxy-trợ-nhuộm-MinHairShop-i.1191391775.25614403866?sp_atk=4abf0f61-1fc6-458a-8fc9-ffe659624750&xptdk=4abf0f61-1fc6-458a-8fc9-ffe659624750,"Thuốc Nhuộm Tóc Màu ĐEN TUYỀN Không Tẩy, Tặng kèm Oxy trợ nhuộm | MinHairShop",Dưỡng Nhiều|||Không Dụng Cụ
https://shopee.vn/Thuốc-Nhuộm-Tóc-Màu-ĐEN-TUYỀN-Không-Tẩy-Thuốc-nhuộm-tóc-Kadola-i.1053243071.25300247453?sp_atk=132d2208-b140-472b-a0c9-205a6483b162&xptdk=132d2208-b140-472b-a0c9-205a6483b162,Thuốc Nhuộm Tóc Màu ĐEN TUYỀN Không Tẩy  Thuốc nhuộm tóc Kadola,nhuộm collagen dưỡng
https://shopee.vn/Thuốc-Nhuộm-Tóc-Màu-ĐEN-TUYỀN-Không-Tẩy-Chenglovehair-Chenglovehairs-i.261570329.7644505684?sp_atk=bf4047a3-8848-4add-b053-0d13900b9099&xptdk=bf4047a3-8848-4add-b053-0d13900b9099,"Yêu thích+Thuốc Nhuộm Tóc Màu ĐEN TUYỀN Không Tẩy | Chenglovehair, Chenglovehairs",Dưỡng ít - 65k|||Không
https://shopee.vn/Thuốc-nhuộm-tóc-màu-Đen-Tuyền-tặng-kèm-dụng-cụ-nhuộm-Thuốc-nhuộm-tóc-Hiền-Thục-i.1026688226.20395481891?sp_atk=29017fc9-5fe5-4e02-877d-c45f347a7fb5&xptdk=29017fc9-5fe5-4e02-877d-c45f347a7fb5,Thuốc nhuộm tóc màu Đen Tuyền tặng kèm dụng cụ nhuộm | Thuốc nhuộm tóc Hiền Thục,Collagen dưỡng
https://shopee.vn/-rẻ-vô-địch-Thuốc-nhuộm-Tóc-Tại-nhà-màu-Đen-Tuyền-kèm-oxi-và-gang-tay-i.1000952802.22867913768?sp_atk=b16ce4b4-ac70-4ab5-ba45-91da7ad684b8&xptdk=b16ce4b4-ac70-4ab5-ba45-91da7ad684b8,Yêu thích[rẻ vô địch] Thuốc nhuộm Tóc Tại nhà màu Đen Tuyền kèm oxi và gang tay,no_variation
https://shopee.vn/Thuốc-Nhuộm-Tóc-màu-đen-tuyền-đen-tự-nhiên-tặng-kèm-bộ-dụng-cụ-nhuộm-tóc-i.773610946.20907315507?sp_atk=ff10bdcd-5563-4967-8c53-0611a3bed1b5&xptdk=ff10bdcd-5563-4967-8c53-0611a3bed1b5,"Yêu thíchThuốc Nhuộm Tóc màu đen tuyền, đen tự nhiên tặng kèm bộ dụng cụ nhuộm tóc",TN+oxi+Bộ dụng cụ
https://shopee.vn/thuốc-nhuộm-tóc-.-nhuộm-tóc-màu-đen-tuyền-màu-nhuộm-không-tẩy-tặng-kèm-oxy-trợ-dưỡng-và-bao-tay--i.864618691.18247191940?sp_atk=0db38ebd-85a8-4722-8eac-f3de0ad939b3&xptdk=0db38ebd-85a8-4722-8eac-f3de0ad939b3,"Yêu thích+thuốc nhuộm tóc . nhuộm tóc màu đen tuyền , màu nhuộm không tẩy [ tặng kèm oxy trợ dưỡng và bao tay ]",dưỡng nhẹ
https://shopee.vn/Thuốc-Nhuộm-Tóc-Màu-ĐEN-TUYỀN-Không-Tẩy-Dorahair-Dorahairs-i.1073061468.22957219747?sp_atk=6560271d-9f8f-42d1-b2f7-2c85d64b2e62&xptdk=6560271d-9f8f-42d1-b2f7-2c85d64b2e62,"Yêu thíchThuốc Nhuộm Tóc Màu ĐEN TUYỀN Không Tẩy | Dorahair, Dorahairs",Dưỡng Nhiều|||Không Dụng Cụ
https://shopee.vn/Thuốc-Nhuộm-Tóc-Màu-ĐEN-TỰ-NHIÊN-Đen-Tuyền-Hạ-Nền-Trên-Mọi-Nền-Tóc-Hanahairs-tặng-kèm-găng-tay-trợ-nhuộm-tiện-lợi.-i.853668476.20941587136?sp_atk=21485144-f6d6-4a0b-94b0-b183f9814835&xptdk=21485144-f6d6-4a0b-94b0-b183f9814835,"Thuốc Nhuộm Tóc Màu ĐEN TỰ NHIÊN , Đen Tuyền | Hạ Nền Trên Mọi Nền Tóc Hanahairs tặng kèm găng tay trợ nhuộm tiện lợi.",Dưỡng Ít 65k|||Không
https://shopee.vn/-NHUỘM-ĐEN-Thuốc-Nhuộm-Tóc-Màu-Đen-Tuyền-Lên-Từ-Mọi-Nền-Tóc-Hạ-Nền-Minzihair-Minzihair-HCM-i.389293200.6881157234?sp_atk=ea280ec8-5d6a-4b34-ac7a-254d9d857be7&xptdk=ea280ec8-5d6a-4b34-ac7a-254d9d857be7,"Yêu thích[NHUỘM ĐEN] Thuốc Nhuộm Tóc Màu Đen Tuyền - Lên Từ Mọi Nền Tóc - Hạ Nền - Minzihair, Minzihair HCM",DƯỠNG COLLAGEN
https://shopee.vn/Combo-Thuốc-Nhuộm-Tóc-MÀU-ĐEN-TUYỀN-Nhuộm-Tại-Nhà-Không-Cần-Tẩy-(Tặng-Kèm-Oxi-Găng-Tay-HDSD)-i.1000145743.22843691499?sp_atk=508ff71c-0aea-4c74-a64d-47d418fbcf92&xptdk=508ff71c-0aea-4c74-a64d-47d418fbcf92,Yêu thíchCombo Thuốc Nhuộm Tóc MÀU ĐEN TUYỀN Nhuộm Tại Nhà Không Cần Tẩy (Tặng Kèm Oxi+Găng Tay+HDSD),Combo+Dưỡng
https://shopee.vn/Thuốc-Nhuộm-Tóc-màu-Đen-Tự-Nhiên-Đen-Than-Chì-Đen-Tuyền-Không-tẩy-i.821597954.23460683611?sp_atk=b3154c11-63ca-4626-b7d8-1e62a60f44e6&xptdk=b3154c11-63ca-4626-b7d8-1e62a60f44e6,"Thuốc Nhuộm Tóc màu Đen Tự Nhiên, Đen Than Chì, Đen Tuyền - Không tẩy",Đen tự nhiên|||Collagen dưỡng
https://shopee.vn/Thuốc-nhuộm-tóc-màu-đen-tuyền-Molokai-siêu-dưỡng-thuốc-nhuộm-tóc-tại-nhà-Pretty-Valley-Store-i.240287148.7825083773?sp_atk=b7e32706-99e4-4c06-9fcd-ec683e9d1128&xptdk=b7e32706-99e4-4c06-9fcd-ec683e9d1128,"Yêu thích+Thuốc nhuộm tóc màu đen tuyền Molokai siêu dưỡng, thuốc nhuộm tóc tại nhà - Pretty Valley Store",Dưỡng nhiều|||KHÔNG
https://shopee.vn/Thuốc-nhuộm-tóc-MÀU-ĐEN-TUYỀN-KHÔNG-TẨY-i.133514218.23402246410?sp_atk=be1297b4-f276-47e9-b954-a66b4358bd1e&xptdk=be1297b4-f276-47e9-b954-a66b4358bd1e,Thuốc nhuộm tóc MÀU ĐEN TUYỀN/KHÔNG TẨY,no_variation
https://shopee.vn/Thuốc-nhuộm-tóc-tại-nhà-màu-Đen-Tuyền-không-tẩy-tặng-kèm-trợ-nhuộm-oxy-bao-tay-và-mũ-chùm-ủ-tóc-i.307975.23645311360?sp_atk=f3954107-ca9f-47ca-9d33-2dfb20c12e7f&xptdk=f3954107-ca9f-47ca-9d33-2dfb20c12e7f,"Thuốc nhuộm tóc tại nhà màu Đen Tuyền không tẩy tặng kèm trợ nhuộm oxy, bao tay và mũ chùm ủ tóc",no_variation
https://shopee.vn/Thuốc-Nhuộm-Tóc-Màu-Đen-Tuyền-(Tặng-Kèm-Oxy-Chụp-Tóc-Bao-Tay)-i.33973720.11979675272?sp_atk=919bae1b-9488-4cda-8f11-84e5fbe86fb8&xptdk=919bae1b-9488-4cda-8f11-84e5fbe86fb8,Yêu thích+Thuốc Nhuộm Tóc Màu Đen Tuyền (Tặng Kèm Oxy + Chụp Tóc + Bao Tay),Dưỡng Nhiều
https://shopee.vn/Thuốc-Nhuộm-Tóc-Nam-Màu-ĐEN-TUYỀN-Không-Tẩy-Chenglovehair-Chenglovehairs-i.975537143.21478170271?sp_atk=05b25f6e-85bb-4d1e-9fd0-dbaa83f5a509&xptdk=05b25f6e-85bb-4d1e-9fd0-dbaa83f5a509,"Thuốc Nhuộm Tóc Nam Màu ĐEN TUYỀN Không Tẩy | Chenglovehair, Chenglovehairs",Dưỡng ít - 65k|||Không
https://shopee.vn/Thuốc-Nhuộm-Tóc-Màu-ĐEN-TUYỀN-LÊN-TỪ-MỌI-NỀN-TÓC-haniehair-i.969018237.23939214726?sp_atk=4f13cb7b-d962-4f77-9e0a-ba47cc3aa92d&xptdk=4f13cb7b-d962-4f77-9e0a-ba47cc3aa92d,Thuốc Nhuộm Tóc Màu ĐEN TUYỀN - LÊN TỪ MỌI NỀN TÓC  | haniehair,Dưỡng Full dungcu
https://shopee.vn/Thuốc-nhuộm-tóc-màu-Đen-tuyền-không-tẩy-dưỡng-tóc-sử-dụng-tại-nhà-tặng-kèm-trợ-nhuộm-và-gang-tay-HarryColor-i.320974472.7858313664?sp_atk=3b737631-2ce8-42bd-a008-cd2d709b1540&xptdk=3b737631-2ce8-42bd-a008-cd2d709b1540,Thuốc nhuộm tóc màu Đen tuyền không tẩy - dưỡng tóc sử dụng tại nhà + tặng kèm trợ nhuộm và gang tay | HarryColor,ĐEN THAN CHÌ
https://shopee.vn/Thuốc-nhuộm-tóc-màu-Đen-tuyền-Happi.Hair-cao-cấp-an-toàn-nội-địa-Trung-i.7785865.11125099420?sp_atk=bd79c91a-b76f-4cf6-8bf3-e4cde38ee01c&xptdk=bd79c91a-b76f-4cf6-8bf3-e4cde38ee01c,"Thuốc nhuộm tóc màu Đen tuyền, Happi.Hair , cao cấp , an toàn, nội địa Trung",Thuốc dưỡng tốt
https://shopee.vn/Thuốc-nhuộm-tóc-màu-Đen-Thuần-Đen-Tuyền-Đen-Tự-Nhiên-hạ-nền-kèm-trợ-dưỡng-găng-tay-thuocnhuomtoc60k.hanoi-i.124896542.1904358549?sp_atk=bd558434-c833-4004-8b0c-3fe160f2b872&xptdk=bd558434-c833-4004-8b0c-3fe160f2b872,"Yêu thích+Thuốc nhuộm tóc màu Đen Thuần, Đen Tuyền, Đen Tự Nhiên hạ nền kèm trợ dưỡng găng tay thuocnhuomtoc60k.hanoi",Đen tự nhiên|||Dưỡngcollagenkeratin
https://shopee.vn/Thuốc-Nhuộm-Tóc-Màu-Đen-Tuyền-2-0-Pure-Naturals-Hair-Dye-Cream-i.125347458.11317554713?sp_atk=d6487fcc-ad75-4155-92c1-612d949c75c8&xptdk=d6487fcc-ad75-4155-92c1-612d949c75c8,Yêu thíchThuốc Nhuộm Tóc Màu Đen Tuyền 2/0 Pure Naturals Hair Dye Cream,tuýp màu - oxi 6
https://shopee.vn/Thuốc-nhuộm-tóc-màu-Đen-Thuần-Đen-Tuyền-Đen-Tự-Nhiên-hạ-nền-Tặng-Oxy-Trợ-Nhuộm-Găng-Tay-Mũ-Ủ-i.290629259.11497292076?sp_atk=074e5787-a1db-4e03-b772-dc7dfedb4fb1&xptdk=074e5787-a1db-4e03-b772-dc7dfedb4fb1,"Yêu thích+Thuốc nhuộm tóc màu Đen Thuần, Đen Tuyền, Đen Tự Nhiên hạ nền Tặng Oxy Trợ Nhuộm Găng Tay Mũ Ủ",MÀU NHUỘM ĐEN TUYỀN
https://shopee.vn/Thuốc-Nhuộm-Tóc-Màu-Đen-Tự-Nhiên-Đen-Tuyền-Lên-Từ-Mọi-Nền-Tóc-Hạ-Nền-100G-Khanh.Color-i.184558438.20931056934?sp_atk=4fcb47eb-e1a9-4986-8b19-6e8c20c6035d&xptdk=4fcb47eb-e1a9-4986-8b19-6e8c20c6035d,Yêu thíchThuốc Nhuộm Tóc Màu Đen Tự  Nhiên | Đen Tuyền | Lên Từ Mọi Nền Tóc | Hạ Nền 100G- Khanh.Color,Siêu Dưỡng Collagen|||Không
https://shopee.vn/Thuốc-nhuộm-tóc-màu-ĐEN-TUYỀN-theo-trend-BLACKPINK-siêu-cute-dễ-thương-MIEHAIR-i.133858810.23759025516?sp_atk=eeed9be5-f97a-49ab-b57a-a714decc38c5&xptdk=eeed9be5-f97a-49ab-b57a-a714decc38c5,Thuốc nhuộm tóc màu ĐEN TUYỀN theo trend BLACKPINK siêu cute dễ thương MIEHAIR,DƯỠNG THẤP|||KHÔNG
https://shopee.vn/Thuốc-Nhuộm-Tóc-Màu-Đen-Tuyền-MOLOKAI-Thuốc-Nhuộm-Tóc-Siêu-Dưỡng-Pretty-Valley-Store-i.240287148.7337404079?sp_atk=f56c545f-6329-4a29-b324-0fbef0c13fb5&xptdk=f56c545f-6329-4a29-b324-0fbef0c13fb5,"Yêu thích+Thuốc Nhuộm Tóc Màu Đen Tuyền MOLOKAI, Thuốc Nhuộm Tóc Siêu Dưỡng - Pretty Valley Store",Dưỡng nhiều|||KHÔNG
https://shopee.vn/Thuốc-nhuộm-tóc-màu-Đen-Tuyền-tặng-kèm-oxy-và-gang-tay-i.284355980.18939389714?sp_atk=b2667149-3fac-495b-9276-b931af653fbb&xptdk=b2667149-3fac-495b-9276-b931af653fbb,Thuốc nhuộm tóc màu Đen Tuyền + tặng kèm oxy và gang tay,L1- 59k Dưỡng vừa
https://shopee.vn/Thuốc-Nhuộm-Tóc-Màu-ĐEN-TUYỀN-Không-Tẩy-Tặng-Oxy-Trợ-Nhuộm-Găng-Tay-Mũ-Ủ-i.411790822.11497344964?sp_atk=d88a0bde-6a97-4c4d-86d6-db13565d60b1&xptdk=d88a0bde-6a97-4c4d-86d6-db13565d60b1,"Yêu thíchThuốc Nhuộm Tóc Màu ĐEN TUYỀN Không Tẩy Tặng Oxy Trợ Nhuộm Găng Tay, Mũ Ủ",MÀU NHUỘM ĐEN TUYỀN
https://shopee.vn/Thuốc-Nhuộm-Tóc-Màu-Đen-Tuyền-Risu-Hair-i.181559230.13292727081?sp_atk=7e21a00d-ebeb-48da-98c3-bfc70abb7432&xptdk=7e21a00d-ebeb-48da-98c3-bfc70abb7432,Thuốc Nhuộm Tóc Màu Đen Tuyền - Risu Hair,Set nhuộm dưỡng ít
https://shopee.vn/Thuốc-nhuộm-tóc-Hàn-màu-Đen-Tuyền-i.947915877.23726957949?sp_atk=23a61e3a-828e-488a-8499-0e396618edaf&xptdk=23a61e3a-828e-488a-8499-0e396618edaf,Thuốc nhuộm tóc Hàn màu Đen Tuyền,Dưỡng nhiều
https://shopee.vn/Thuốc-nhuộm-tóc-đen-tự-nhiên-nên-từ-mọi-nền-tóc-Thuốc-nhuộm-đen-tự-nhiên-đen-tuyền-màu-nhuộm-phủ-bạc-100ml-i.240027877.23546401925?sp_atk=fe69f2ce-98f1-4a3e-8ffb-6d0ac5fdf977&xptdk=fe69f2ce-98f1-4a3e-8ffb-6d0ac5fdf977,"Yêu thích+Thuốc nhuộm tóc đen tự nhiên, nên từ mọi nền tóc, Thuốc nhuộm đen tự nhiên, đen tuyền, màu nhuộm phủ bạc  100ml",Màu dưỡng ít
https://shopee.vn/Thuốc-Nhuộm-Tóc-Màu-ĐEN-TUYỀN-Không-Tẩy-100g-Beli-Official-Store-i.317065252.15662083003?sp_atk=42560dd7-90e1-4930-b2b0-a8a343f25ba4&xptdk=42560dd7-90e1-4930-b2b0-a8a343f25ba4,Thuốc Nhuộm Tóc Màu ĐEN TUYỀN Không Tẩy 100g - Beli Official Store,Thuốc + Dưỡng
https://shopee.vn/Thuốc-Nhuộm-Tóc-Màu-ĐEN-TUYỀN-Lên-Mọi-Nền-Tóc-Nhộm-Tóc-Tại-Nhà-Vuong.hair-i.338597092.18729117901?sp_atk=fdc9910c-95f7-4db4-8fc6-f3e288623dac&xptdk=fdc9910c-95f7-4db4-8fc6-f3e288623dac,"Thuốc Nhuộm Tóc Màu ĐEN TUYỀN Lên Mọi Nền Tóc, Nhộm Tóc Tại Nhà | Vuong.hair",Nhiều dưỡng - 160k
https://shopee.vn/Nhuộm-đen-Thuốc-nhuộm-tóc-Màu-Đen-Tuyền-Nhuộm-Đen-Phủ-Bạc-Từ-Mọi-Nền-Tóc-Minzihair-HN-i.294764281.6661064787?sp_atk=eba42a1b-3038-4c94-9785-52436f207d6d&xptdk=eba42a1b-3038-4c94-9785-52436f207d6d,Nhuộm đen - Thuốc nhuộm tóc Màu Đen Tuyền - Nhuộm Đen & Phủ Bạc Từ Mọi Nền Tóc - Minzihair HN,Siêu dưỡng Collagen
https://shopee.vn/Thuốc-nhuộm-tóc-đen-tuyền-nên-từ-mọi-nền-tóc-không-cần-thuốc-tẩy-tóc-đen-tuyền-màu-nhuộm-phủ-bạc-đen-tự-nhiên-100ml-i.240027877.9942769091?sp_atk=d532aca3-33e0-453f-9201-46ab514ca5ce&xptdk=d532aca3-33e0-453f-9201-46ab514ca5ce,"Yêu thích+Thuốc nhuộm tóc đen tuyền nên từ mọi nền tóc không cần thuốc tẩy tóc,đen tuyền,màu nhuộm phủ bạc, đen tự nhiên 100ml",Màu dưỡng Ít
https://shopee.vn/Thuốc-Nhuộm-Tóc-Màu-ĐEN-TUYỀN-Không-Tẩy-Nhuộm-Trên-Tất-Cả-Nền-Tóc-Chính-Hãng-Tại-Nhà-Aymy-i.857494500.21849637451?sp_atk=e6d6713a-5fac-4279-9118-27415c037ca7&xptdk=e6d6713a-5fac-4279-9118-27415c037ca7,Thuốc Nhuộm Tóc Màu ĐEN TUYỀN Không Tẩy | Nhuộm Trên Tất Cả Nền Tóc Chính Hãng Tại Nhà Aymy,Dưỡng Nhiều
https://shopee.vn/Thuốc-nhuộm-tóc-ĐEN-TUYỀN-ĐEN-TỰ-NHIÊN-không-tẩy-kem-nhuộm-tóc-tại-nhà-hạn-nền-phủ-bạc-Kolorhair-i.988765464.19380905101?sp_atk=aad198e5-155c-4a9b-a1e0-2fcf10b82c77&xptdk=aad198e5-155c-4a9b-a1e0-2fcf10b82c77,"Thuốc nhuộm tóc ĐEN TUYỀN, ĐEN TỰ NHIÊN không tẩy, kem nhuộm tóc tại nhà hạn nền phủ bạc Kolorhair",Dưỡng nhiều - 169k|||Không dụng cụ
https://shopee.vn/THUỐC-NHUỘM-TÓC-ĐEN-TUYỀN-LÊN-MÀU-SIÊU-CHUẨN-CAO-CẤP-GIÁ-SỈ-SIÊU-RẺ-i.971188853.18877066641?sp_atk=43a02fdb-a3f4-4d3c-9f2b-3f62aec84dce&xptdk=43a02fdb-a3f4-4d3c-9f2b-3f62aec84dce,THUỐC NHUỘM TÓC ĐEN TUYỀN LÊN MÀU SIÊU CHUẨN CAO CẤP GIÁ SỈ SIÊU RẺ,TỐT
https://shopee.vn/Thuốc-Nhuộm-Tóc-Màu-ĐEN-TUYỀN-Không-Tẩy-Tặng-Kèm-Oxy-Găng-Tay-Mũ-Ủ-i.813675813.20738409829?sp_atk=c4f64b5f-c871-4f64-97c3-3ac8b2159669&xptdk=c4f64b5f-c871-4f64-97c3-3ac8b2159669,"Yêu thíchThuốc Nhuộm Tóc Màu ĐEN TUYỀN Không Tẩy Tặng Kèm Oxy , Găng Tay , Mũ Ủ",MÀU NHUỘM ĐEN TUYỀN
https://shopee.vn/Thuốc-Nhuộm-Tóc-Thuốc-Nhuộm-Tóc-Tại-Nhà-Màu-ĐEN-TUYỀN-Không-Tẩy-Tặng-Kèm-Găng-Tay-Và-Oxy-i.1037239202.23074689046?sp_atk=0b1ee7de-4382-4021-8404-293447097b21&xptdk=0b1ee7de-4382-4021-8404-293447097b21,"Thuốc Nhuộm Tóc , Thuốc Nhuộm Tóc Tại Nhà Màu ĐEN TUYỀN Không Tẩy Tặng Kèm Găng Tay Và Oxy",no_variation
https://shopee.vn/Thuốc-Nhuộm-Tóc-Màu-ĐEN-TUYỀN-Đen-Tự-Nhiên-Không-Tẩy-kem-nhuộm-tóc-tại-nhà-tặng-kèm-găng-tay-chùm-đầu-TNT.HAIR-i.328108810.23774590017?sp_atk=52c39597-8822-4679-b0ee-a00f632d05ae&xptdk=52c39597-8822-4679-b0ee-a00f632d05ae,"Thuốc Nhuộm Tóc Màu ĐEN TUYỀN, Đen Tự Nhiên Không Tẩy, kem nhuộm tóc tại nhà tặng kèm găng tay, chùm đầu | TNT.HAIR",Dưỡng Ít 65k
https://shopee.vn/Thuốc-Nhuộm-Tóc-Màu-Đen-Tuyền-SÀNH-LOVE-HAIR-Thuốc-Nhuộm-Đen-Không-Tẩy-Tặng-Kèm-Oxy-Trợ-Nhuộm-Găng-Tay-Và-Mũ-i.987669657.22741883968?sp_atk=00d87ba2-d637-4272-bec5-fba57e4f65f9&xptdk=00d87ba2-d637-4272-bec5-fba57e4f65f9,"Thuốc Nhuộm Tóc Màu Đen Tuyền SÀNH LOVE HAIR - Thuốc Nhuộm Đen Không Tẩy, Tặng Kèm Oxy Trợ Nhuộm + Găng Tay Và Mũ",Dưỡng Nhiều|||Không dụng cụ
https://shopee.vn/Thuốc-nhuộm-tóc-màu-đen-Hello-Cream-1B-đen-tuyền-Nhuộm-tóc-Mise-En-Scence-Hello-Cream-1B-i.268869564.20452143285?sp_atk=ebc0ba70-758d-414c-955b-631a4b969ef1&xptdk=ebc0ba70-758d-414c-955b-631a4b969ef1,Thuốc nhuộm tóc màu đen Hello Cream 1B đen tuyền | Nhuộm tóc Mise En Scence Hello Cream 1B,no_variation
https://shopee.vn/Thuốc-Nhuộm-Tóc-KoolPro-Màu-Đen-Tuyền-Không-Tẩy-100g-tặng-kèm-dụng-cụ-nhuộm-i.767578558.12494178070?sp_atk=567523c5-fc2a-457c-942e-3f5ef2570199&xptdk=567523c5-fc2a-457c-942e-3f5ef2570199,Thuốc Nhuộm Tóc KoolPro Màu Đen Tuyền Không Tẩy 100g tặng kèm dụng cụ nhuộm,Thuốc + dưỡng
https://shopee.vn/Thuốc-Nhuộm-Tóc-Màu-Đen-Tuyền-Đen-Tự-Nhiên-2.0-Natural-Black-Dye-Cream-i.79237961.10918039120?sp_atk=eba49b5f-4008-4199-a59d-c62e260bf236&xptdk=eba49b5f-4008-4199-a59d-c62e260bf236,"Yêu thíchThuốc Nhuộm Tóc Màu Đen Tuyền, Đen Tự Nhiên 2.0 Natural Black Dye Cream",Thuốc
https://shopee.vn/Thuốc-nhuộm-tóc-màu-Đen-Tuyền-màu-nhuộm-lân-chuẩn-tone-Đen-Tuyền-kem-nhuộm-an-toàn-nhuộm-không-sót-da-đầu-mùi-thơm-i.240543985.6195399755?sp_atk=f779c556-d485-48da-bc0d-5cf17e2d702b&xptdk=f779c556-d485-48da-bc0d-5cf17e2d702b,Yêu thíchThuốc nhuộm tóc màu Đen Tuyền màu nhuộm lân chuẩn tone Đen Tuyền kem nhuộm an toàn nhuộm không sót da đầu mùi thơm,DƯỠNG NHIỀU 
https://shopee.vn/Thuốc-Nhuộm-Tóc-Màu-Đen-Tự-Nhiên-Đen-Tuyền-2-0-Natural-Black-Hair-Dye-Cream-i.181951261.2977556992?sp_atk=0b74d1ac-e731-480c-b29e-c0b10e63627c&xptdk=0b74d1ac-e731-480c-b29e-c0b10e63627c,"Yêu thíchThuốc Nhuộm Tóc Màu Đen Tự Nhiên, Đen Tuyền 2/0 Natural Black Hair Dye Cream",Trợ Oxy Only 3 or 6%
https://shopee.vn/-KHÔNG-TẨY-Thuốc-nhuộm-tóc-MÀU-ĐEN-TUYỀN-phủ-được-TÓC-BẠC-i.83372150.8383730248?sp_atk=2b7c2f9c-9919-4dd7-bc58-07bb2fa31009&xptdk=2b7c2f9c-9919-4dd7-bc58-07bb2fa31009,[KHÔNG TẨY] Thuốc nhuộm tóc MÀU ĐEN TUYỀN phủ được TÓC BẠC,Dưỡng Colagen
https://shopee.vn/Thuốc-Nhuộm-Tóc-Màu-ĐEN-TUYỀN-Không-Tẩy-Tặng-Kèm-Oxy-Trợ-Nhuộm-Găng-Tay-Mũ-Ủ-i.371075019.21227435281?sp_atk=6e79f679-ad05-41ce-98c4-2c8dda066d78&xptdk=6e79f679-ad05-41ce-98c4-2c8dda066d78,Yêu thích+Thuốc Nhuộm Tóc Màu ĐEN TUYỀN Không Tẩy Tặng Kèm Oxy Trợ Nhuộm Găng Tay Mũ Ủ,THUỐC NHUỘM
https://shopee.vn/Thuốc-Nhuộm-Tóc-Màu-Đen-Tự-Nhiên-Đen-Tuyền-2-0-Natural-Black-Hair-Dye-Cream-HV02-i.423376786.21386451763?sp_atk=df1504d0-89c8-425a-ba2a-97e4051a47c8&xptdk=df1504d0-89c8-425a-ba2a-97e4051a47c8,"Yêu thíchThuốc Nhuộm Tóc Màu Đen Tự Nhiên, Đen Tuyền 2/0 Natural Black Hair Dye Cream HV02",LẺ TUÝP MÀU 100G
https://shopee.vn/Thuốc-nhuộm-tóc-màu-ĐEN-TUYỀN-không-cần-tẩy-Kirei-Hair-KireiHair-KIREIHAIR-i.453810830.9573968556?sp_atk=00a3972d-bc5c-4a33-a505-f3139f9003d7&xptdk=00a3972d-bc5c-4a33-a505-f3139f9003d7,"Yêu thíchThuốc nhuộm tóc màu ĐEN TUYỀN không cần tẩy Kirei Hair, KireiHair, KIREIHAIR",Dưỡng ít
https://shopee.vn/Combo-Thuốc-Nhuộm-Tóc-Tại-Nhà-Màu-ĐEN-TUYỀN-Tặng-Oxi-Dưỡng-Găng-Tay-HDSD-i.1010186454.21394980070?sp_atk=435d4fcc-5928-410c-b033-21c3b3c1a578&xptdk=435d4fcc-5928-410c-b033-21c3b3c1a578,Yêu thíchCombo Thuốc Nhuộm Tóc Tại Nhà Màu ĐEN TUYỀN Tặng Oxi Dưỡng + Găng Tay + HDSD,dưỡng keratin
https://shopee.vn/Thuốc-nhuộm-tóc-BalckPink-màu-đen-tuyền-1B-Thuốc-nhuộm-tóc-phủ-bạc-Mise-En-Scence-Hàn-Quốc-i.195320119.5442288221?sp_atk=b4be3963-9261-41b0-8286-3d9afe575272&xptdk=b4be3963-9261-41b0-8286-3d9afe575272,Thuốc nhuộm tóc BalckPink màu đen tuyền 1B | Thuốc nhuộm tóc phủ bạc Mise En Scence Hàn Quốc,no_variation
https://shopee.vn/Thuốc-nhuộm-tóc-Molokai-màu-đen-tuyền-60ml-M-36-nhuộm-tóc-tại-nhà-chứa-collagen-tảo-biển-siêu-dưỡng-Hajian-Beauty-i.768620554.19629263749?sp_atk=ef486464-06a8-4185-a213-ede2afc4ab5c&xptdk=ef486464-06a8-4185-a213-ede2afc4ab5c,"Thuốc nhuộm tóc Molokai màu đen tuyền 60ml M-36, nhuộm tóc tại nhà chứa collagen tảo biển siêu dưỡng - Hajian Beauty",Tóc ngang lưng|||Không
https://shopee.vn/Thuốc-nhuộm-tóc-phủ-bạc-Pyeonan-Hàn-Quốc-gội-khô-nhuộm-thảo-dược-màu-đen-tuyền-Black-mà-không-làm-khô-tóc-5-gói-i.241746875.19480346797?sp_atk=7e3d0740-38ac-4b76-abb8-e253536431a5&xptdk=7e3d0740-38ac-4b76-abb8-e253536431a5,Thuốc nhuộm tóc phủ bạc Pyeonan Hàn Quốc gội khô nhuộm thảo dược màu đen tuyền Black mà không làm khô tóc 5 gói,no_variation
https://shopee.vn/Thuốc-Nhuộm-Tóc-Màu-Đen-Tuyền-̣-Phù-Hợp-Mọi-Tone-Da-Tặng-Oxy-trợ-dưỡng-COLLAGEN-TRÀ-XANH-100ml-i.95973053.3793306593?sp_atk=0645c07a-388f-49ad-bca8-8f66006c8b57&xptdk=0645c07a-388f-49ad-bca8-8f66006c8b57,Thuốc Nhuộm Tóc Màu Đen Tuyền ̣ Phù Hợp Mọi Tone Da - Tặng Oxy trợ dưỡng COLLAGEN TRÀ XANH 100ml,Dưỡng Collagen tươi
https://shopee.vn/Thuốc-nhuộm-màu-đen-thuần-đen-tuyền-hạ-nền-kèm-trợ-dưỡng-găng-tay-thuocnhuomtoc60k.hanoi-i.456783180.10913656671?sp_atk=f88f7584-197a-426f-8f98-79d0e0d95b1f&xptdk=f88f7584-197a-426f-8f98-79d0e0d95b1f,Thuốc nhuộm màu đen thuần đen tuyền hạ nền kèm trợ dưỡng găng tay thuocnhuomtoc60k.hanoi,Đen tự nhiên|||Dưỡng thường 1
