link,title,variation
https://shopee.vn/Bảng-Kem-Che-Khuyết-Điểm-3-Màu-Che-Phủ-Quầng-Thâm-Mắt-Và-Mặt-Chuyên-Nghiệp-i.148824448.21308831350?sp_atk=3e944c3e-a48e-453e-8004-ec399ea3f641&xptdk=3e944c3e-a48e-453e-8004-ec399ea3f641,Yêu thíchBảng Kem Che Khuyết Điểm 3 Màu Che Phủ Quầng Thâm Mắt Và Mặt Chuyên Nghiệp,no_variation
https://shopee.vn/【100-thiệt】Honey-Beauty-Che-Khuyết-Điểm-3-Màu-Bảng-Kem-Che-Khuyết-Điểm-che-phủ-mụn-và-quầng-thâm-mắt-4.5g-i.1039240622.18482253807?sp_atk=0baa66be-efe4-4263-be00-455aad73223a&xptdk=0baa66be-efe4-4263-be00-455aad73223a,【100% thiệt】Honey Beauty Che Khuyết Điểm 3 Màu Bảng Kem Che Khuyết Điểm che phủ mụn và quầng thâm mắt 4.5g,Kem che khuyết điểm * 1 + cọ c
https://shopee.vn/Kem-Che-Khuyết-Điểm-Mf250-Dạng-Bút-Mềm-Mại-Che-Phủ-Lỗ-Chân-Lông-Hiệu-Quả-Yin-CKD-147-i.852297654.19339956872?sp_atk=943f68fc-ddab-4ce9-acb1-3286d8dab7e8&xptdk=943f68fc-ddab-4ce9-acb1-3286d8dab7e8,Yêu thích+Kem Che Khuyết Điểm Mf250 Dạng Bút Mềm Mại Che Phủ Lỗ Chân Lông Hiệu Quả Yin CKD 147,Khuôn kẻ mày
https://shopee.vn/Kem-Che-Khuyết-Điểm-Mf250-Che-Phủ-Quầng-Thâm-Kem-Khuyết-Điểm-Che-Mụn-Hoàn-Hảo-Cho-Da-Mềm-Mại-S1CKD-147-i.293904860.21934756809?sp_atk=c2786aed-cf13-46c4-be4a-10379daa87f5&xptdk=c2786aed-cf13-46c4-be4a-10379daa87f5,Yêu thích+Kem Che Khuyết Điểm Mf250 Che Phủ Quầng Thâm Kem Khuyết Điểm Che Mụn Hoàn Hảo Cho Da Mềm Mại S1CKD 147,no_variation
https://shopee.vn/Kem-Che-Khuyết-Điểm-Mf250-Che-Phủ-Quầng-Thâm-Và-Mụn-Hoàn-Hảo-Cho-Da-Mềm-Mại-CKD-147-Ruci-i.293896341.17882254014?sp_atk=091f820c-646e-4176-a2e8-afed12751196&xptdk=091f820c-646e-4176-a2e8-afed12751196,Kem Che Khuyết Điểm Mf250 Che Phủ Quầng Thâm Và Mụn Hoàn Hảo Cho Da Mềm Mại CKD 147 Ruci,no_variation
https://shopee.vn/Kem-Che-Khuyết-Điểm-Mf250-Che-Phủ-Quầng-Thâm-Và-Mụn-Hoàn-Hảo-Cho-Da-Mềm-Mại-i.409397702.18110687961?sp_atk=514acfce-24a6-43de-bb3b-21531ca7922f&xptdk=514acfce-24a6-43de-bb3b-21531ca7922f,Kem Che Khuyết Điểm Mf250 Che Phủ Quầng Thâm Và Mụn Hoàn Hảo Cho Da Mềm Mại,no_variation
https://shopee.vn/Kem-Che-Khuyết-Điểm-Mf250-Che-Phủ-Quầng-Thâm-Và-Mụn-Hoàn-Hảo-Cho-Da-Mềm-Mại-CKD-147-i.294406164.21533142339?sp_atk=ef9e164f-028a-4d42-8222-b801e23a16ea&xptdk=ef9e164f-028a-4d42-8222-b801e23a16ea,Yêu thíchKem Che Khuyết Điểm Mf250 Che Phủ Quầng Thâm Và Mụn Hoàn Hảo Cho Da Mềm Mại CKD 147,no_variation
https://shopee.vn/Kem-Lót-Trang-Điểm-ZEESEA-3-Màu-Sắc-Tùy-Chọn-Dưỡng-Ẩm-Làm-Trắng-Da-Che-Khuyết-Điểm-Kiềm-Dầu-i.805597787.21051713386?sp_atk=5b777759-ced8-4ebc-8ee2-a72e629a1601&xptdk=5b777759-ced8-4ebc-8ee2-a72e629a1601,Yêu thíchKem Lót Trang Điểm ZEESEA 3 Màu Sắc Tùy Chọn Dưỡng Ẩm Làm Trắng Da Che Khuyết Điểm Kiềm Dầu,Màu tím|||2 chiếc
https://shopee.vn/Kem-Che-Khuyết-Điểm-3-màu-MAFICK-Mf250-i.856075685.18670826140?sp_atk=5a284292-5b1a-45b9-b20b-971c711793d2&xptdk=5a284292-5b1a-45b9-b20b-971c711793d2,Kem Che Khuyết Điểm 3 màu MAFICK Mf250,no_variation
https://shopee.vn/Kem-Che-Khuyết-Điểm-3-Màu-XIAOYUMI-Hoàn-Hảo-2022-MM-i.74804504.13695691509?sp_atk=bdd91f95-1fff-46fb-91d5-62337f5facae&xptdk=bdd91f95-1fff-46fb-91d5-62337f5facae,Yêu thíchKem Che Khuyết Điểm 3 Màu XIAOYUMI Hoàn Hảo 2022 MM,3 kem che khuyết điểm
https://shopee.vn/(Bán-Buôn-Sỉ)-Kem-che-khuyết-điểm-Lameila-3-màu-tùy-chọn-độ-che-phủ-cao-chông-thấm-nước-giữ-màu-lâu-trôi-K29-i.19958411.17282258065?sp_atk=28447473-a723-40a3-b96a-afaf2d0200de&xptdk=28447473-a723-40a3-b96a-afaf2d0200de,Yêu thích(Bán Buôn Sỉ) Kem che khuyết điểm Lameila 3 màu tùy chọn độ che phủ cao chông thấm nước giữ màu lâu trôi K29,# Mẫu cũ
https://shopee.vn/Bảng-Kem-Che-Khuyết-Điểm-Sweet-mint-DIKALU-3-Màu-Che-Phủ-Quầng-Thâm-Mắt-Và-Mặt-Chuyên-Nghiệp-i.365012449.20068153538?sp_atk=352ba8c0-aa0a-45ca-98b6-9e54397fe0c1&xptdk=352ba8c0-aa0a-45ca-98b6-9e54397fe0c1,Bảng Kem Che Khuyết Điểm Sweet mint DIKALU 3 Màu Che Phủ Quầng Thâm Mắt Và Mặt Chuyên Nghiệp,Chải
https://shopee.vn/Kem-che-khuyết-điểm-Xiao-Yumi-3-màu-Che-Phủ-Quầng-Thâm-Và-Nếp-Nhăn-Cho-Da-i.12964260.23109613354?sp_atk=bbb24ab1-78ba-45ec-925c-a4c0316b0584&xptdk=bbb24ab1-78ba-45ec-925c-a4c0316b0584,Kem che khuyết điểm Xiao Yumi 3 màu Che Phủ Quầng Thâm Và Nếp Nhăn Cho Da,Chekhuyếtđiểm+cọtán
https://shopee.vn/Kem-Che-Khuyết-Điểm-Flawless-PERFECT-DIARY-3-màu-mịn-màng-không-tì-vết-7ml-i.277411443.5753984255?sp_atk=8fda5234-87fc-471d-b054-05b0d4155927&xptdk=8fda5234-87fc-471d-b054-05b0d4155927,Kem Che Khuyết Điểm Flawless PERFECT DIARY 3 màu mịn màng không tì vết 7ml,C10
https://shopee.vn/Kem-che-khuyết-điểm-Lameila-3.3g-3-màu-tùy-chọn-i.361217864.8749366718?sp_atk=81bf2749-1498-4e8d-9c18-3af8024380f4&xptdk=81bf2749-1498-4e8d-9c18-3af8024380f4,Kem che khuyết điểm Lameila 3.3g 3 màu tùy chọn,2#
https://shopee.vn/(Sỉ-siêu-rẻ)-Kem-che-khuyết-điểm-3-màu-Lameila-che-phủ-quầng-thâm-mắt-chông-thấm-nước-giữ-màu-lâu-trôi-K29-i.11220423.22110757824?sp_atk=3a189cfd-3f6a-464a-880b-43233fefee82&xptdk=3a189cfd-3f6a-464a-880b-43233fefee82,Yêu thích(Sỉ siêu rẻ) Kem che khuyết điểm 3 màu Lameila che phủ quầng thâm mắt chông thấm nước giữ màu lâu trôi K29,#2
https://shopee.vn/Kem-Che-Khuyết-Điểm-3-Tone-Màu-Xiao-Yumi-Lâu-Trôi-Che-Phủ-Cao-Làm-Sáng-Da-15g-i.294030011.23310574465?sp_atk=149b2f44-080e-4d41-8156-68d347c9a946&xptdk=149b2f44-080e-4d41-8156-68d347c9a946,"Yêu thích+Kem Che Khuyết Điểm 3 Tone Màu Xiao Yumi Lâu Trôi, Che Phủ Cao, Làm Sáng Da 15g",no_variation
https://shopee.vn/Kem-che-khuyết-điểm-3-tone-màu-XI0221-che-mọi-khuyết-điểm-Xiaoyumi-làm-da-mịn-và-dành-cho-da-thâm-mụn-i.79285599.20441457554?sp_atk=a85c6aaa-3a1f-4a9f-8eec-8c18f24ae5f9&xptdk=a85c6aaa-3a1f-4a9f-8eec-8c18f24ae5f9,Yêu thíchKem che khuyết điểm 3 tone màu XI0221 che mọi khuyết điểm Xiaoyumi làm da mịn và dành cho da thâm mụn,Cọ Che kđ KM
https://shopee.vn/Combo-Kem-Che-Khuyết-Điểm-3-Màu-Xiao-Yumi-và-Cọ-Tán-i.160885513.23025683940?sp_atk=5ac3cbaf-6507-4236-9f8f-0bdbc33e9701&xptdk=5ac3cbaf-6507-4236-9f8f-0bdbc33e9701,Combo Kem Che Khuyết Điểm 3 Màu Xiao Yumi và Cọ Tán,CKĐ 3 MÀU XIAO YUMI
https://shopee.vn/Kem-Che-Khuyết-Điểm-3-ô-MF250-cao-cấp-tự-nhiên-mềm-mịn-lâu-trôi-nội-địa-sỉ-rẻ-CONCEALER-WE-STORE-i.1069693207.24209581662?sp_atk=643de4d0-9376-440a-9fae-8249b0a753f8&xptdk=643de4d0-9376-440a-9fae-8249b0a753f8,Kem Che Khuyết Điểm 3 ô MF250 cao cấp tự nhiên  mềm mịn lâu trôi nội địa sỉ rẻ CONCEALER WE STORE,03
https://shopee.vn/Kem-Che-Khuyết-Điểm-mf250-Giúp-Trị-Mụn-Và-Kiềm-Dầu-Cao-Cấp-Tri-i.1108887625.24050160587?sp_atk=b6b356bc-eece-4290-88cb-1f03fb19d989&xptdk=b6b356bc-eece-4290-88cb-1f03fb19d989,Kem Che Khuyết Điểm mf250 Giúp Trị Mụn Và Kiềm Dầu Cao Cấp Tri,Kem che khuyết điểm ba màu Hai
https://shopee.vn/Kem-Che-Khuyết-Điểm-Ba-Màu-Mf250-Dạng-Thỏi-Che-Phủ-Lỗ-Chân-Lông-Quầng-Thâm-Mụn-Hiệu-Quả-i.508596913.21926383277?sp_atk=08065e0e-119c-4f19-aec9-506616fc6df3&xptdk=08065e0e-119c-4f19-aec9-506616fc6df3,Kem Che Khuyết Điểm Ba Màu Mf250 Dạng Thỏi Che Phủ Lỗ Chân Lông / Quầng Thâm / Mụn Hiệu Quả,no_variation
https://shopee.vn/Kem-Che-Khuyết-Điểm-Ba-Màu-Che-Phủ-Mụn-Và-Vết-Thâm-Trên-Da-Khô-MF250-N-WEN-i.815681326.20537167480?sp_atk=e0904c7d-6110-4f9c-8942-23cb12499bbd&xptdk=e0904c7d-6110-4f9c-8942-23cb12499bbd,Kem Che Khuyết Điểm Ba Màu Che Phủ Mụn Và Vết Thâm Trên Da Khô MF250 N WEN,Kem che khuyết điểm ba màu Miễ
https://shopee.vn/Kem-Che-Khuyết-Điểm-Ba-Màu-Nhẹ-Nhàng-Che-Phủ-Đốm-Mụn-Và-Kiềm-Dầu-Cho-Da-Khô-MF250-Maffick-i.1068918894.24059618152?sp_atk=13a599c7-df2a-46af-ac0c-8814babf4ea2&xptdk=13a599c7-df2a-46af-ac0c-8814babf4ea2,Kem Che Khuyết Điểm Ba Màu Nhẹ Nhàng Che Phủ Đốm Mụn Và Kiềm Dầu Cho Da Khô MF250 Maffick,no_variation
https://shopee.vn/Hộp-kem-che-khuyết-điểm-SVMY-3-màu-giúp-tạo-khối-làm-sáng-da-che-mụn-quầng-thâm-hickies-i.53909647.19981744434?sp_atk=969bc4f0-a1ad-4e8d-b0b9-4a14aa33091b&xptdk=969bc4f0-a1ad-4e8d-b0b9-4a14aa33091b,"Hộp kem che khuyết điểm SVMY 3 màu giúp tạo khối, làm sáng da, che mụn, quầng thâm - hickies",Hộp đen|||1 hộp kem + 1 cọ
https://shopee.vn/Kem-che-khuyết-điểm-YUMI-3-màu-lâu-trôi-che-phủ-làm-sáng-da-quầng-thâm-mắt-che-khuyết-điểm-đi-chơi-ngày-tết-Hatola-i.167635200.18442539959?sp_atk=029af9bd-330d-404b-92dc-47e81eb3e68b&xptdk=029af9bd-330d-404b-92dc-47e81eb3e68b,"Yêu thích+Kem che khuyết điểm YUMI 3 màu lâu trôi che phủ làm sáng da quầng thâm mắt, che khuyết điểm đi chơi ngày tết Hatola",Che khuyết điểm 3 ô
https://shopee.vn/Kem-Che-Khuyết-Điểm-Xiao-Yumi-3-Tone-Màu-Giúp-Sáng-Da-Che-Phủ-Cao-Lâu-Trôi-15g-i.26577495.15599828272?sp_atk=85c78ab4-e00d-4319-8c01-d1179a13afcd&xptdk=85c78ab4-e00d-4319-8c01-d1179a13afcd,"Kem Che Khuyết Điểm Xiao Yumi 3 Tone Màu Giúp Sáng Da, Che Phủ Cao, Lâu Trôi,15g",no_variation
